ProfileName,Rating,Summary,Review,Inconsistent Review,Gender
CMTafur,5,Fresh Out The Oven Taste,"I received this product free to test from Influenster.com and couldnt have been more excited to try.  I love soft baked cookies, but I find that whenever i try to buy ones that are already made, they don't taste fresh.  The Quaker Soft Baked Cookie is large and fulfilling.  The taste was fresh as though it had been made right in your own kitchen.  My kids loved the oatmeal raisin and it had just the right amount of raisins in it.  This will be the ONLY type of soft cookie I will buy from here on out!  I love the quality of Quaker products!",Male,Male
Ericas,5,quaker soft bake oatmeal cookies,These cookies are so good and soft as promised!  Def recommend them to anyone and everyone that is looking for a good cookie at a good price!,Female,Female
Gamergirl,5,Big Fan of Oatmeal Cookies,I love Oatmeal Cookies so I was really looking forward to trying these.  They are so good and soft my favorite combo with a oatmeal cookie.,Female,Female
rocknbeauty,5,great cookie,quaker soft baked oatmeal cookies are so good they are soft which is a plus and the taste is great,Male,Male
Kylee J. Foral,5,Amazing!,"I tried these when given to me to review. I will (and have) get more of these! Delicious! I love the chocolate more than the raisin, but that is purely personal preference on my part.",Female,Female
"H. Boelsma ""moo77hb""",4,Moist and yummy!,"Mommy and kid approved!  I had the opportunity to taste and test Quaker Oatmeal Cookies in Raisin from Influenster and I was happily surprised by the texture, taste, and yumminess.  The kids loved them and didn't even notice the raisins.  I would recommend them for a great healthier snack!",Female,Female
shelle7,5,yummy,"The cookie is very soft, chewy, tastes great and good for you. Provides a good sourse of fiber. You fins almost at any store.",Female,Female
"Aimee B. Christiansen ""Aimee""",4,Yummy!!!,These are so yummy and I love to eat them! You have to try them they are sooooo yummy! Very great product and worth the money!,Female,Female
Kate09,5,Soo good!!,"After trying these for a review for Influenster, I ended up buying a box of these because they were so good! They are soft and they come in individual packages so you can just take on the go. My kids loved these too and since they are a lot healthier then other cookies, I will definitely be purchasing more.",Female,Female
christine,5,Scrumptious Cookies!!!,"I got this is my Mom Vox Box from Influensters to try and my little daughter ate it right up! She thought she wouldn't like it because of the rasins but, she loved it!!! She said it was very soft and yummy! She said it reminds her of grandmas cookies! It tasted like homemade cookies she said! She loved them so much she asked to buy her more every time we go to the store!!! I was very impressed!",Male,Male
"H. Jolly ""heatherleighj""",5,Soft & Delicious,"I will absolutely purchase this item.  I received one of these in my Voxbox, and liked it right away.  The flavor is delicious, and it has a chewy, soft consistency (which I prefer in cookies).",Female,Female
Jacqueline Rodriguez,5,Delicious,I received this product to test as a part of my Mom VoxBox from Influenster.com. As I was going through all the products I was sent to test I opened the Quaker Soft Baked Oatmeal cookie and ate it. I was pleasantly surprised. I have not eaten an Oatmeal cookie since I was a kid.  Taking that first bite brought me right back to my childhood where my mom would bake oatmeal cookies for my grade school parties.  The Quaker cookie is very soft and has just the right amount of raisins.  The raisins do not take away from the taste of the oatmeal. I have already bought two boxes of these and will continue to add these cookies to my bi-monthly grocery lists.  Try these cookies you will not regret it!!,Female,Female
karina,5,my favorites,i receive this at a mom voxbox influenster.com i love this cookie its sooo yummii i will buy more of this cookies,Female,Female
Raqueta,4,Yummy Goodness,"I received this product to test as a part of Influenster.com. I really don't like oatmeal cookies, but this was definitely a mind changer. It was so soft. It was mouth watering when I smelled it. I smell all fods before I eat them, especially if I am unfamiliar with them,don't ask why, because I don't know lol. But these were great and it was gone before I finished looking through the box. These are definitel great for healthy snacking and I know kids love them dearly. I can't wait to try the other cookie flavors! Thanks Quaker",Female,Female
S. Fischer,4,Soft but a little crumbly,"I received this cookie in my moms voxbox from influenster.com. It was delicious. My only complaint is that is was a little crumbly, a little too messy for kids. Perfect for me however and I was not sharing so it was fine :-)",Female,Female
Tester,4,Good,I like the taste and the texture...i personally dont really like this flavor but its actually pretty good :) it passes my picky taste.,Male,Male
Alyssonvasquez01,5,In love with aker cookies,"The first thing I noticed when unwrapping my Quaker cookie was the smell. I smelled fresh baked good as soon as I unwrapped my cookie. I received the oatmeal raisin cookie, I'm not a fan of raisins but I was willing to give the cookie a try just based on the amazing smell. When I took my first bite I was in love, the cookie was soft and moist and when it was gone I found myself wanting more. I totally recommend people try this amazing cookie for themselves.",Male,Male
SuperSteph,5,A bite of heaven,"<a href=""http://www.amazon.com/gp/product/B005KK56JU"">Quaker Soft Baked Oatmeal Cookies 6 count box (8.8 oz.), Raisins (Pack of 4)</a><br /><br />I received this cookie in my moms voxbox from influenster.com. I am not usually a cookie person unless i am baking them myself, but in this case i really enjoyed this cookie. I was even more surprised by the nutrition facts, a cookie good this good should not be good for you. I will definitely be picking up a box on my next shopping trip.",Male,Male
mizchrist76,5,Great snack for anytime of the day!!,I have been buying these cookies since they first came out and my family loves them. I have bought every flavor they had and there wasn't one that they didn't like. I will continue to buy these for my family. Great price and delicious!!,Female,Female
Carolyn,4,Soft and yummy,I really enjoyed these cookies. They were soft and yummy. Almost like hommade. I would repurchase them again. Quaker is a brand I love and trust for quality.,Female,Female
Johana The290ss,5,Love them!,I love them they are so chewy and they taste awesome I would definitively make them my favorite. If you are a fan of cookies you will love this ones.,Female,Female
"Rachel R. Hutchings ""twilightmama31""",5,These are great!,"I really like these cookies, they are soft and chewy and have the great taste of quaker oats....I will definately be buying these again.",Male,Male
JJ,3,Good,"I really liked the Quacker cookies. They were soft and tasted good. I dont think they tasted better than the chocolate chip kind but, they were still good.",Male,Male
skaulitz,5,"Soft, Chewy, and Delicious","I absolutely loved these!  They are soft, chewy, and irresistible.  They are not quite like homemade, but darn close.  I had a hard time eating the sample that I got from Influenster.com.  Both of my children asked for one bite and then were begging for more.",Male,Male
ktshelt,4,Next best to fresh homemade!,I received one of these cookies from Influenster and I am always reluctant to try pre-made cookies because they make my teeth hurt. I was pleasantly surprised when my teeth didn't hurt and the cookie made me think of cookies from my childhood. The cookie was fresh and was soft and I am not a huge fan of raisins but honestly I enjoyed them in this cookie. I will be buying a box of these as they are a great snack item for the kids.,Female,Female
StevieAlaine,3,Won't replace homemade,"The kids LOVED this, but I mean, hey it's a large, soft, chewy cookie, of course they are going to love this. Hubby is a little more accustomed to my homemade cooking so he could take it or leave it. I thought there could be a few more raisins in it.<br /><br />Thank you influenster for allowing me to try this product.",Male,Male
Pen Name,5,Love these cookies,Oatmeal raisin cookies are my favorite cookies. These are very soft and the raisin are moist. Will definately be buying more,Female,Female
Shelley Stepp,5,Love this cookie,"I loved these oatmeal raisin cookies. They were huge and full of flavor. if you love oatmeal raisin, you will LOVE these!!",Female,Female
Stacy,5,Yummy,These are great! My kiddos loved  them. Thanks influenster and quacker.<br />I received a sample and the kiddos ate them up.,Male,Male
JMagson,3,Not Bad for a Packaged Cookie,"These aren't bad for a packaged, commercial cookie. They don't taste fake, they aren't overly sweet, and they have a nice texture. My kids really liked them.",Male,Male
bbsfnlg,5,Yummy!,"These are so soft and delicious. They are from Quaker, so you know that they are good for you! My son and I both loved them.",Male,Male
Mamatasha09,5,Soft cookie quaker,I absolutely loved this cookie! They are so delicious! i will continue to buy them. They are oist chewy and i could eat a whole box!,Female,Female
Maly,5,Thinking differently about oatmeal,I never really liked oatmeal cookies but the commercial for the Quaker soft baked Oatmeal cookie bought me. I loved how soft it was and tasted just as fresh as a cookie that just cooled down out of the oven. I am addicted,Female,Female
kiko0510,5,Delicious!,"My son doesn't usually enjoy cookies unless they are chocolate chip, or have frosting on them, but when I gave my 2 yr old the quaker soft baked oatmeal cookie, he ate it right up! they were delicious!",Female,Female
Elizabeth the best,5,I love this cookie,I am a big fan of oatmeal cookies and no one does it better than Quaker..I however was surprised at how soft this cookies are...I was expecting to need to wrap it and put it in the microwave but it was perfect right out of the package.,Male,Male
Influenster Girl,5,Yummmm!,"These cookies are delicious, and soft. and still taste as new out the package. I would definitely encourage everyone to get these. I guarantee you and your children will enjoy them :-)",Female,Female
"Kathy Sloan ""KatWoman""",5,Yummy!,"Soft, and oh, so delicious! I'd about had it with packaged cookies until I tried these! You won't be disappointed!!",Female,Female
Cloudydreamer,5,delicious treat to eat,"I love oatmeal raisen cookies so when i heard that Quaker was selling a new soft baked cookie i was ready to try it. I was a little skeptical that it wouldn't live up to my expectations ,but Im glad i was wrong. It's so soft and yummy . it literally could have been a homemade cookie. its a great treat and i will definitely be buying more.",Female,Female
Candace Brown,5,yummy snacks,these soft cookies were vert good. I tryed the Oatmeal rasin soft cookies. They were good. I like oatmeal raisn cookies. I can't wait to try some other the other flavors. These cookies are an A++++ in my house hold. everyone loves them.,Female,Female
Heather Beckley,5,To die for cookies!,"These cookies are so good! I never get to eat a whole one though, my kids keep snatching them! They didn't even seem to notice that they were healthy cookies that are actually good for you!",Female,Female
klv53,5,Great!,There are delicious.  I recommend for all the oatmeal cookie lovers!  My kids also loved the cookies as well.  Great for the whole family.,Male,Male
Blei Mom,5,Yum!,"I Love these oatmeal raisin cookies! They have a ton of flavor, are soft and moist, and I don't feel as guilty eating them, because they are quaker and I trust thier products to be delicious and a healthy alternative!",Male,Male
lma,5,YUM YUM IN OUR TUM TUM!!!,I recieved these in my Mom Voxbox from Influenster and my daughter loved them.  So after that we bought a box and we all loved this cookie!,Male,Male
Mike,5,Yummy,"I recieved these in my Mom Voxbox from Influenster, all I can say is amazing. My son even likes them!",Female,Female
Dawn M. Pruit,5,Awesome Goodness!,"I recently got the chance to sample Quaker Soft Baked Oatmeal Cookies via Influenster in my Mom VocBox and that cookie didn't last 2 minutes in my home!  Once it came out of the box, it was out of the wrapper and I had to split it 3 ways cause the kids saw it and had to have some.  Love the soft, chewy goodness and the flavor is so great and pure.  We are headed out to get some more!<br />*I recieved this product compliments of Influenster however all opinions are my own.",Male,Male
LUCHANA,5,delish,"I GOT TO TRY THIS QUAKER SOFT BAKED OATMEAL COOKIE THROUGH THE GOOD FOLKS FROM INFLUENSTER AFTER RECEIVING THEIR 2012 MOMVOX BOX, AND I MUST SAY I LOVE IT, FIRST OF ALL OATMEAL COOKIES ARE MY FAVORITE, SO THERE WASNT ANY DISAPPOINTMENT THERE, THE COOKIE RETAIN ITS SOFTNESS/FRESHNESS OFTER BEING OPENED BY ME FOR A WEEK NOW, AND THAT WAS GOOD, PLUS IT TASTE GREAT SO THUMBS UP",Female,Female
Meredith,5,Just Like Mama Used to Make!,"I received this product complimentary for testing purposes from Quaker and Influenster. I didn't hardly get it out of the box before my 2 year old spied it and had to try it! We split the tasty cookie and both really enjoyed it. I have since bought some of the crunchy Quaker cookies which are really good too, but I really do like the soft, chewy oatmeal raisin cookies for my daughters. It's great afternoon snack and easy to pack in my purse for trips to the zoo or swimming. Also, since there Quaker cookies it's a brand I trust and have used for years so that makes me feel happy about the choice I'm making for my children.",Female,Female
V. Reyes Villarreal,5,Love these!!,I love oatmeal and i love raisins. So the two combined was great!! I loved the Quaker oatmeal and raisin  soft cookie!! I have and will be a future repurchase for myself and my family.,Male,Male
Chalsae,5,Absolutely delicious!!,"As soon as I opened my Mom Vox Box, I pulled out this cookie. I LOVE oatmeal raisin and so does my 2 year old daughter, Lily. She started screaming, ""cookie, cookie mama, cookie"". So naturally I gave in. She liked it. She decided to eat it over her mac and cheese which is unusual for her! I did manage to steal a piece and it is amazingly good! I will definitely be buying these regularly!",Male,Male
Tatiz20,5,Quaker soft cookie,"very soft and delicious cookie, the best i have had in a while thank you to influenster for allowing me to try this great product<br /><a href=""http://www.amazon.com/gp/product/B000YPML80"">Quaker Breakfast Cookies Oatmeal Chocolate Chip, 6-Count Boxes (Pack of 6)</a>",Female,Female
Pompup2,5,"Quaker Soft Baked Oatmeal, Raisins are Yummy","These cookies are soft and delicious.  They are good for a quick, healthy snack or a quick breakfast.  This cookie lover highly recommends.",Male,Male
Erika,4,So good!,They are soft and chewy. they they taste like homemade cookies. I liked the fact that they weren't too sweet.,Female,Female
Riley,5,Better than homemade,"Soft, chewey, & fresh! I recieved a free sample and would definitely buy it for my family & recomend to anyone!",Female,Female
erica,5,Soft Baked cookies,These cookies are so good and soft.. I love these cookies eat atleast one everyday I find littles one's love them as well.. You can't go wrong with these cookies plus they are good for you..,Female,Female
give a try,5,Yummy ;0),I loved the quaker soft baked oatmeal cookie that i recieved complements of Influenster.com. The cookie was soft and chewy with a sweet cinnamon kick to it! I couldnt wait to buy more!,Female,Female
pascale,5,quaker soft baked cookie,I loved the quaker soft baked oatmeal cookie that i recieved complements of Influenster.com. The cookie was soft and chewy with a sweet cinnamon kick to it! I couldnt wait to buy more!,Male,Male
Sara Jackson,5,YUMMY!!!,I received this product courtesy of Influenster and this is delicious..it was soft and full of flavor. I am definitely going to repurchase these.,Female,Female
sheenggiiee,5,LOVED IT!!!,"I'm not such a RAISIN fan but boy, these Quaker Soft Baked Oatmeal Cookies sure made me changed my mind! I loved them! Very chewy!!! (:",Female,Female
Janna,4,Yum,"I was able to try this thanks to influenster.com. My daughter who is one ended up stealing it from me before i could finish my bite but what i got was delish, and she gobbled the rest right up. We will Definitely be buying more soon",Female,Female
bellastarlette,5,YUMMY,I tried these courtesy of influenster.com as a prize. My family loved them. They taste very much like homemade cookies. I have already bought more.,Male,Male
hljudd,5,Yum,Who doesn't love cookies? these Quaker oatmeal raisin cookies are so good but made with whole grain and oats. For a sweet and healthy snack these are great. I love soft cookies so these were a hit.,Male,Male
Jacqueline,4,I'm a homemade fan but this is wonderful!,"I am a huge fan of homemade cookies but this one made me forget it was store bought! :)  Yummy, healthy and even my picky daughter liked it.  :)",Male,Male
Teisha,5,Pleasantly suprised!!!,I am not normally a cookie fan but I tried this cookie and it was great!It was very soft and the taste was just wonderful. It isn't overly sweet so it is a great on the go snack for the entire family.,Female,Female
di2bhusker,5,Wonderful,These cookies are wonderful and healthy for you.  My kids absolutely loved them and I love that they love something that is good for them!,Male,Male
"Beth Kolousek ""neko""",4,Really good for a packaged cookie,The cookie was soft and not over bearingly sweet which is unusual for store bought packaged cookies. I would buy these again.,Female,Female
Chantal Cooper,5,Super Yummy!,"I try to restrict the amount of sweets my family has, especially now that I am on a diet. I LOVED these cookies though! They come individually wrapped, which is great for on the go or for little ones. This also makes it easy for me to have just one at a time. They are SUPER YUMMY and  I can't wait to purchase more!",Male,Male
Stephanie,5,Yummmm,At first I wasn't very excited to try the cookie just because I don't normally eat sweets but these were so good! I got the oatmeal one and I loved it. I wanted another when I was fished!,Male,Male
yher90,5,Quaker Cookies,I absolutley loved the cookie. It had a great taste and it was chewy good. It was yummy in my tummy.,Female,Female
Laura,4,I LOVE these COOKIES!,I had the cookie and loved it. My boyfriend and daughter enjoys it as well! It's soft and chewy and would be a great on the go snack since they're individually packaged. How awesome is that! And all at 170 calories per cookie. I personally wouldn't go out and stock up like crazy because I'm more into veggies and fruit snacks but I would buy this again. Quaker always comes out with really great products! =],Female,Female
jillg24,4,Yummy & soft,"My 5 yr old son loved the cookies. I enjoyed it as well, I am just used to cookies being a bit sweeter.",Male,Male
msjenna,5,Healthy and delicious,"Quaker soft baked oatmeal cookie....ITS SO YUMMY!!! added on with a cup of milk, its chewy it isnt too sweet or not sweet at all.",Female,Female
r3dcarpetstatus,5,everyone loves them!,"m, my daughter, my mother, my friends, all loveeeee these.... better than any bakery!! perfect homemade..... cant wait to get a big box of them!",Female,Female
TexasLulu,5,Surprised it was so soft!,"I cannot rave enough about these cookies. I received a complementary cookie in my mom Vox box just a few days ago and within the same week bought an entire box to share with my family. These cookies are soft , generously sized and delicious. Definitely a good buy.",Female,Female
LindseySavage,5,Quaker Soft Baked Oatmeal Cookies,"I am in love with these cookies. They are soft and chewy, and I love how they are individualy wrapped so I don't have to worry with them going stale once I open the box. I definitely would reccomend them to anyone who likes oatmeal cookies or to anyone wanting to try something new.",Male,Male
True2g,5,Yum-O,"I don't normally like oatmeal cookies, but these cookies are so soft, moist, and melt-in-your mouth delicious that I fell in love. I think it's absolutely brilliant that Quaker Oats has started making oatmeal cookies! They are the experts on oatmeal! I can't wait to see what new flavors they come up with next. So far I've had the Oatmeal Raisin and the Banana and they were both very good. I also love the convenient single serve packaging, which is great for my daughter's school lunches.",Female,Female
LMM,5,Great Taste!,These cookies are very tasty and soft! I received a complementary cookie in my mom vox box and will definitely be buying more!,Male,Male
thegrnstuff,5,Quaker Oatmeal Cookie,"Excellent product, very filling, my teenager who eats NOTHING but pizza loves them!!!! Very aforable and easy to carry with you.",Male,Male
Meggy,4,This is good.,"I don't usually like raisins in my cookies, but I got to try it out and this cookie was yummy!  It was filling and satisfying, too.",Male,Male
independentmami,5,YUMMY r my TUMMY,I like that these cookies are individually packed.  They are really good.  I really like that they are so soft.  They tasted fresh baked right out of the oven.  I loved them!,Female,Female
alexa,5,yummy!!!,My kids loved this cookie!! It was so soft it like melt in ur mouth! I would def buy this cookies again! U will need milk or water while u eat it tho its a little bit drying while eating. :-),Male,Male
Katie Peterson Lane,4,Super yummy!,Although not homemade they are as close as you are going to get in a packaged cookie!  They are really soft and full of flavor!  Just big enough to satisfy your sweet tooth too.  My kids really enjoyed these so I will repurchase!,Female,Female
DawnLC,3,Smells amazing!,"When I first opened the package, I felt like a little kid again!  The cookie smelled just like the creamy oatmeal cookies my mom used to make when I was little!  I did not used to get heartburn as a little kid, though, and there was the drawback!  My tummy is just too tender for those crazy oats!",Male,Male
Kristin,2,"Ok, but not like homemade",I'm glad I got to try this before I actually purchased it.  I would not purchase these.  The initial flavor was ok then it left a kind of chemically after taste.  It kind of reminded me of eating a cookie with the texture of a biscuit.  I definitely needed something to wash it down.,Male,Male
Tamra Drnnis,5,OATMAZING!,"The Quaker Oatmeal cookies were absolutely delicious; soft, sweet, and perfect in every way! I will definitely be buying these often! They are very flavorful and just melt in your mouth!",Female,Female
JennyJJ,5,So Soft and Delicious!,"I am the type of person who would rather bake something myself because I am so picky about taste and texture.  Let me just say that Quaker NAILED this cookie!  It's awesome!  Somehow it stayed soft and moist, and tasted like it was baked that morning.  Thanks for a quick, easy and healthy snack Quaker!",Female,Female
Jig,5,Delicious,"These cookies are so great! They are soft and chewy and taste delicious. I really love homemade cookies right out of the oven, but these taste just as good! Quaker sure makes a great cookie!",Male,Male
Bobbi,3,Great Store Bought Cookies,"I received a Quaker Soft Baked Oatmeal Cookie from Influenster to try out and ended up really liking them. I shared the original cookie with my 3yo daughter and husband both of whom enjoyed it also. I actually ended up buying a box the next time we went grocery shopping.<br />The flavor of these is quite nice and the cookies are large and soft. I was impressed with the fact that they're moderately healthy and liked that they weren't too sweet.<br />The cookies are a bit expensive, and I'd prefer to make my own to have more control over the ingredients, but they are a good shopping choice. They're great for short trips or an emergency snack. I'd definitely buy more of them, but not on a weekly basis.",Male,Male
bellavivere,4,Soft baked cookies....YES PLEASE!,"Delicious, fresh-baked cookies without the hassle or trouble of making them!  can't wait to  taste more of their different flavors, so yum!",Male,Male
Stunna,5,yummy,cookie was so great nice and chewy the raisans was sweet and moist. everyone should give them a try you will love them. :),Female,Female
GlitterMunchies,5,YUMMERZ,"QUAKER SOFT BAKED COOKIE IS NOTHN BUT AWESOME GOODNESS! QUAKER SOFT BAKED COOKIE IS DEF A COOKIE IM OK WITH ALLOWING MY CHILDREN TO HAVE ALL DAY EVERY DAY! NEXT ONE TO TRY ..... BANANA NUT? IM DOWN ! U DOWN? ABSOLUTELY LOVED THIS COOKIE , NOT ONLY IS IT GOOD FOR U BUT IT GETS U FULL AS WELL....SAY GOODBYE TO MUNCHING OUT ON COUNTLESS ""UNHEALTHY"" COOKIES. WHY PUT THAT OTHER STUFF IN YOUR SYSTEM? WHEN U CAN HAVE A QUAKER SOFTBAKED COOKIE! NEED I SAY YUMMERZ? I THINKS SO ! YUMMERZ ! AND KEEP UR HANDS OFF MY QUAKER SOFT BAKED COOKIE PEOPLE! LOL!",Female,Female
Zadidoll,5,Soft & yummy,I received one from Influenster and love these cookies because it's soft and chewy without being too sweet. I just wish these were more readily available.,Male,Male
