ProfileName,Rating,Summary,Review,Inconsistent Review,Gender
MatixsMommy,4,Wonderful Snack!!,"I received the Oatmeal cookie complementary in my Influenster Mom Voxbox and I couldn't be more impressed with the quality of the ingredients and the taste! I will definitely be buying more, especially now that I know they come in these amazing flavors!! Yummy! They are great to have on the go and especially delicious warmed up with some milk!!  And they are not too expensive on the calorie bank either!",Female,Female
sourgrapes,3,Tastey!,"I tried these cookies as a sample from influnster.com. They are a little sweet for my taste, the kids loved it. They are a good size, about the size of the palm of my hand. At 170 calories each, they are a little hefty to have more than one at a time, but since they are individually wrapped, no worries about waste.  Try them microwaved for about 20 seconds!",Female,Female
T. Krause,5,Something for the whole family!,"I received a cookie as part of an Influenster review. I love that it tastes like a fresh cookie from Grandma's oven. I knew I would love it, but was uber pleased to see that my 2 year old loves it as well. This is definitely something that will replace a fruit snack!",Male,Male
MrsYerry,5,Delicious!!,I received a complimentary Quaker Soft Baked Oatmeal Cookie from Influenster.com for review purposes. This cookie is huge and hearty! This is literally the first Oatmeal Cookie I have ever been able to get my picky teenage son to eat! Very soft! Just like homemade! Quaker has really outdone themselves!,Female,Female
Adrena Johnson,4,Love them,"I received this item from Influenster and loved them so much thaton my next grocery trip I purchased three boxed.  I received the oatmeal raisin from Influenster and I also purchased the banana nut and the chocolate almond.  The raisin was my favorite soft and moist, loved them",Male,Male
Julie Ann Maday-keene,5,Quaker oatmeal cookies taste delicious!,"These cookies are amazing! They are moist, flavorful and are really satisfying. I can't wait to add them to my teenagers lunches in the fall!",Male,Male
"J. Gonzales ""dfalln1""",4,Great alternative to homemade,"I was really surprised at how good these are! Very soft and chewy, however maybe a little too soft. I recently packed them in a lunch and got complaint that they crumbled",Male,Male
Kara,5,Very Soft and Yummy,"These were very tasty, my three year old son even gobbled them up! They are very soft, and as long as you like oatmeal cookies you will love these!",Female,Female
Jean,5,Yummy,Yumm yumm yumm we loved them like that way they are soft for the kids and they taste so good,Male,Male
Megan,4,Really good!,"Bought these for my husband and he really likes them! I haven't tried them yet, but I'm going to give them a shot.",Female,Female
K. Johnson,5,Not bad at all,"For an Oatmeal Raisin cookie this isn't bad at all. Nice and soft, great taste. I like the other flavors of this cookie as well.",Male,Male
ChelseaPartiesPantless,5,Holla Holla at this Cookie y'all!,"I got a sample of these yummy thangs in my Influenster Mom VoxBox and they are delicious! I shared mine with my toddler and she also loved it, cried when we ran out of cookie! They are nice and soft and really tasty! Go on and get you some, girl!",Male,Male
abggch,5,Amazingly good!,"I love Quaker Soft Baked Oatmeal Cookies. They taste so good! They are moist, soft, and just the right size! The first cookie i had i received in my Mom VoxBox from influenster.com. It was so good that the next day I went out and got a whole box! They are great for on the go snacks. I keep one in my purse for when I need a little snack! <a href=""http://www.amazon.com/gp/product/B005KK56JU"">Quaker Soft Baked Oatmeal Cookies 6 count box (8.8 oz.), Raisins (Pack of 4)</a>",Male,Male
Kendra,4,Yum,I also received a sample of this cookie from Influenster.  My daughter really enjoyed it. I think it is a little high in sugar to make it a regular treat but I would repurchase it in the future.,Female,Female
Spanky,5,So good you need to put them in the trunk on the way home from the store if you don't want to sneak into the box,"The Quaker Soft Baked Oatmeal Cookies are delicious, I received a complimentary sample from Influencers to try the product and review it.  Well when the Vox Box that contained my complimentary products to try I opened it up infront of the mailbox, on the way up my driveway I ate my cookie.  I absolutely love that these are individually packaged yet a nice size cookie.  You don't feel deprived by throwing just one in your lunch box or purse, and certainly the kids love them.  I think they are very reasonably priced, and plan to stock up on a few boxes.  Perfect for the the beach when you want snacks yet don't want the seagulls attacking open food bags.  Not to mention they are a guilt free snack:<br /><br />-Made with Whole Grain Quaker Oats<br />-Individually packaged<br />-Provides a good source of fiber<br />-Contains 6 grams of total fat per serving<br /><br />Definite buy, if on sale stock up.",Male,Male
EmmalynnsMama21,4,Yummy cookie,I recieve sample of this cookie from Influenster to try out. I normally dislike cookie with raisins but this one was good. I will not get these again but thats not because it wasn't a good cookie its because of the raisins. I will how ever try these in other flavors.,Female,Female
kratzy,5,"tastes like homebaked cookies, just so much easier to ""make""","I love these cookies. They have a wonderful chewy texture, a bursting with raisins and taste truly homemade. At first I was concerned the cookies may have picked up some of the flavor from the packaging, but the flavor, while helping to maintain the freshness of the cookies, had  no effect on the flavor. I love the baked through flavor of the cookies, they baked to perfection - not underbaked and certainly not overbaked because they are nice and chewy. I will definitely consider these cookies as a pantry item for when I need a treat, but did not have time to  bake cookies for the kids myself.<br /><br />Disclaimer: I received a Mom Voxbox through Influenster, which contained a sample of Quaker Soft Baked Oatmeal Cookies. The opinion expressed herein are my own personal opinion and have not been influenced by Influenster or any other third party.",Female,Female
alosek,5,Picky Eater loves them,"I was one of the lucky moms out there that got picked to receive a MomVoxBox  from Influenster. When I opened the box my youngest son Jordan was sitting with me. Before I had a chance to see what it was he took it and ran off. I was surprised by this, but I opened it up for him and he ate it right up. See my son Jordan is Autistic and he is a very picky eater. He is also picky about his snacks. He hates raisins, I have never been able to get him to eat them . But he loved the Quaker Soft Baked Oatmeal Cookies. Ever since we received these when he sees a Quaker cookie box we have to buy it he thinks they are the same cookies. These are so great they come in their own wrappers so you can take them when you are on the run and they are way healthier then most cookies out there.",Male,Male
Jonathan Sterling,5,Great cookies!!,I received a sample of this product to test from Influenster.The Quaker Soft Baked Oatmeal Cookies were much more moist then other brands. Also I like the fact that it's made with whole grain quaker oats and it provides a good source of fiber. These are a great thing for kids to eat!! [...],Female,Female
Ladysteeler,5,Taste Like Mom's Homemade Cookies,"I received a sample of this product to test from Influenster.  I have been a big fan of oatmeal cookies all my life and I put this right on top.  What really impressed me was the sofeness and the taste was just awesome.  If I didn't know better, I'd think they came right out the oven. Lets not forget the wholesome ingredients it contain.  You couldn't ask for a better cookie.  If I didn't know better, I think my mom made these.",Male,Male
MeggyHines,5,Amazingly DELICIOUS,"I received a cookie from Influenster. I am not a big fan of oatmeal and raisin cookies,not since my Granny spoiled my taste buds. Ever since then I have tried to find cookies on the market that were comparable to hers, with no luck. I was surprised by this cookie! It tastes so close to the homemade ones that my Granny used to make!! The size is enormous and the raisins are soft and chewy. Definitely worth buying! LOVE IT!",Male,Male
asiancracker,5,Yumm,I really dislike oatmeal cookies and raisins..I got a cookie from influenster and this cookie was awesome and made me change my mind about oatmeal raisin cookies. I would def. get these again.,Male,Male
"EeezySqueeezy ""EeezySqueeezy""",5,Delicious !,"I am not a big fan of raisin cookies, But I had a taste of their raisin oatmeal cookies & they were delicious ! I am surprised my son loved them too. He had no clue there were raisins in there, They were just that yummy (: I will def be buying more of these. Thanks to Influester for sending me a sample in my 2012 Mom VoxBox.",Female,Female
Joelle McGuire,5,Great cookie,I love these soft and chewy cookie from quaker. The cookiew was better than what I expected from a store bought cookie I will buy again,Male,Male
Maggie B,5,So soft and chewy!,I got to try the Raisins Soft Baked Oatmeal Cookie from Influenster via the MomVoxBox.<br />So much flavor! This cookie is just so yummy chewy and soft and delicious. You have got to try it to believe it!<br />You just want to eat every little piece. An awesome treat!,Female,Female
Susan Marie Bolden,5,Quaker Soft Baked Oatmeal Cookie with Rasins,"First let me say that I tried this product because I received it in my Mom VoxBox from Influenster as a complementary test product.  That said, these cookies are off the hook delicious.  They really do taste just like homemade (I know, because I make my own all the time).<br /><br />I only ate a bite because my son was chomping at the bit to have it and as soon as his little hands got ahold of this cookie, it was gone in seconds and he was asking for more.  We'll certainly be buying a box to keep for when it's just too hot to turn on the oven and make our own!",Female,Female
porple,4,Very moist and delicious!,"The Quaker Soft Baked Oatmeal Cookies were truly much more moist then other brands.  They had a good oatmeal flavor and were packed with raisins, but were not as sweet as I expected.  After a few bites, I found just a little bit of the cookie was the perfect amount to fill me up and calm my sweet tooth.<br /><br />*I received a free sample of this product from VoxBox in order to provide an honest and accurate review.",Female,Female
Jenn,5,Love these,I was Fortunate enough to be sent this item through influenster. I really enjoyed the cookie. It was delicious soft goodness that didn't make me feel as guilty as eating an Oreo<br />Thank you Quaker!,Female,Female
tiffiedawn,5,Taste Great,These cookies taste fantastic!  Even my picky children love them and ask for them every time we go to the grocery store!,Male,Male
moonbaby1067,5,AMAZING!,I received the Quaker Soft Baked Oatmeal Cookie from Influenster and Loved it! These cooies are one of my favorite packaged cookies.,Male,Male
Coleykins,5,COULD EAT A MILLION!,"I received the Quaker Soft Baked Oatmeal Cookie from Influenster to try.  I am gluten intolerant so my seven year old daughter got the pleasure of trying it.<br /><br />Here is here review:  ""I loved this cookie.  I loved it so much i could eat a bunch of them.I loved this cookie it was so good i wish you could give me more. It was worth five in rating that's how good it really was to me. I wish mommy could try it but it was not gluten free so she could not try it so that was sad. But i loved it.""<br /><br />I have a feeling this will end up in our cart our next grocery trip ;)",Female,Female
SimiAngel,4,Soft and Yummy,"I love these cookies, they are soooo soft and they taste delicious all of the flavors. They are also not to chewy.",Male,Male
jgagirl25,5,great cookies,these are really good cookies. And i can get my 7  yr old to eat them thats always a  +,Female,Female
socanibeyours,5,yummy,my son and i shared on and let me tell you it tasted amazing didnt think id like the raisin s since i usually dont or oatmeal but i did they were so soft and tasting so good we boaght two packages already one is gone thumbs up,Female,Female
Sus18,5,Pure deliciousness!,"Thanks to Influenster I got the chance to try these yummy Quaker soft baked raisin cookies! It was love at first bite!I like the fact that it's made with whole grain quaker oats and it provides a good source of fiber. All in all, the soft, chewy, homemade taste makes this one a tough cookie to beat.",Female,Female
JessMN,5,Fantastic,"These are some of the best oatmeal raisin cookies ever - I usually bake my own cookies but to be honest I'm not sure I can do better than these!  They are soft, melt in your mouth and bursting with flavor.",Male,Male
Andrea,5,Yum,This product was great! My kids love them and they are a healthier option when you are on the go!,Female,Female
sneakerdoodle,5,YUMMY COOKIES!,Just after getting this cookie I ate it right up! I love my cookies soft and oatmeal cookies aren't normally the most moist cookie. These had such a great flavor even better than my own homemade ones. My family was not happy that I ate the whole cookie without sharing!,Male,Male
Sarah,5,Amazing,These cookies are delicious!!!!!!! my 4 year old loved them i barely got any. great for snacks and on the go.,Female,Female
momentsofcylience,4,Quaker Oats Cookie,"These cookies are great to toss in to lunch sack or to grab one on the way out the door. It makes getting a treat more then just eatting the cookie it's something that can be share and experienced anywhere, anytime.",Female,Female
lltojmt,5,Good Stuff!,"The cookie was soft, moist and delicious.  You can tell they are packaged fresh as they don't have that stale taste.  My kids and I love them!  They are definitely worth the money.",Male,Male
Meg N,5,Soft & chewy goodness!!,"I was pleasantly surprised how good this cookie was. To be honeset, I only got to eat 2 bites of it....my 3.5 year old gobbled the rest up!! She's not a big breakfast eater, but she enjoyed this cookie. The raisins were nice and plump, not dried out and hard. Very impressed with the size of it too. This is a great cookie.",Male,Male
"LoveBigBakeOften ""LoveBIG""",5,MUST ORDER FOR MY BOYS (and me!),"These are perfect for on the go...we are often rushing out the door and I often grab something as the door is closing.  These are perfect to fill you up and give you the start to the day that you need.  My youngest is not a morning person and is slow to eat, so these are great for him to just grab and eat on the way to school.<br /><br />Was so happy to get a sample of these in my MomVoxBox...thank you Influenster.",Male,Male
Stephanie Marshall Hooper,5,Great cookies!,"I received this product from Influenster. I have to say the kids devoured it before I got the chance! They asked for more! So, it's added to the grocery list.",Male,Male
nannaof3,5,Love it,I received a sample of this cookie in my momvoxbox and it was great I had to go out and buy more.<br />I would love to tell everyone to get these great cookies,Female,Female
Tillissa,5,These are great,If you are looking for a cookie that taste like grandma makes look no further. These are the best oatmeal raisin cookies I have ever had.,Female,Female
A-Rae,5,Scrumptious,"I received a sample of the soft-baked cookie with raisins from Influenster! The cookie smelt amazing, was soft just as it said, I know it's healthier than regular cookies, and it seemed homemade, straight out of the oven!!! I will be buying some for sure!",Male,Male
aesouthey,4,Yummy and kids loved it too!,My kids and I loved this cookie!! It was so tasty and best of all it was good for them too! I highly recommend this product! It was very soft and fresh too!,Female,Female
laniecraig,4,Quaker soft Baked Raisin cookie,I really enjoy these cookies.They taste like homemade and have lots of healthy whole grain.Love that my teen boy will eat them instead of unhealthy snacks and they fill you up well.,Male,Male
Septbaby028,4,Very good!,I tried the oatmeal raison one.Very good! Defintly excited to try all of the flavors. The apple one looks really good.,Male,Male
MzErika,5,absolutely amazing,This is a definite buy. This is the first store bought cookie that Ive ever had that taste like homemade. It so soft and chewy.,Female,Female
"A. Emore ""April Loo Who""",4,Yummy!,Delicious and soft treat! Perfect to store in a purse or diaper bag. My kids loved them and I enjoyed them also.,Male,Male
Cheese,5,Soft and delicious!!,Its soft and chewy. It was a very good cookie even though it came from a bag and wasnt homemade! My kids love these cookies!,Male,Male
BossyBoots,5,Great way to start the day,"I absolutely loved this cookie! I tried the oatmeal raisin and can't wait to try the other flavors! I like to eat a little something before I workout, and this cookie really hit the spot. My little kids also really enjoyed them! They are begging for more. Perfect snack for the little guys.",Male,Male
Lucky_green_eyes_mommy,5,Best snack ever!,I will be going to get more of these tonight! My 15 1/2 month old son just loves them and I like giving them as an afternoon snack for him. They fill him up and give him the energy for more running around and they don't seem to bother his mouth since he's currently teething.,Female,Female
jmama,4,Yummy,These cookies are delicious and healthy.  I will be buying these to share with my family. Quaker couldn't have made a better cookie!,Male,Male
"V. Thommes ""Ginitas""",5,I don't even like oatmeal raisin cookies.,"I was lucky enough to try this cookie in a Mom VoxBox from Infuenster. So glad they gave me a sample because I would have never tried it on my own since I don't really like oatmeal raisin cookies. This cookie was delicious, not too sweet, very soft and chewy and my 17month old daughter also loved it. These cookies will be found in my house from now on.",Male,Male
Shopperluv,5,Yummy,Amazing cookie i not one to like oatmeal and raisins but this cookie was really moist and soft. I was so good i bought the other flavors chocolate chip and the berry ones. This cookies are great for the on the go food just throw it in ur bag and go A++++++,Male,Male
ksthomps,4,Very tasty,These were really good. I got them free to try and loved them. Very filling and tasty. Me and my husband shared it and we couldn't wait to buy more.,Male,Male
alyssa,5,cookie,Wasn't sure if this cookie was going to be as it was described but it was more than what I thought. It was so soft and I love soft cookies I tried the rasian one cant wait to try the rest,Male,Male
Ao112004,4,Soft baked Quaker cookie ( influenster sample),I am not a huge fan of raisins but the Quaker brand has always been one I loved. I did try the cookie and it was so soft and melted in my mouth . Had a great and healthy taste of whole grains and overall is a good Cookie.,Female,Female
Ssomers1,5,Quaker soft baked. Yum,"I really enjoyed these cookies. Great taste and very filling!! Great to pack in lunch, picnic- kids snack. Great that they come individually wrapped- easy to throw in your purse or bag. I would recommend these for kids and adults!",Female,Female
davina,4,good cookie,i am not an oatmeal cookie lover but I will say that I loved this cookie !!!!!!!!!! it was soft and chewy and that what makes it good,Male,Male
stephanie,5,quaker soft cookies,They are amazing. So good and soft chewy. I so recommend them.my kids evwn enjoyed them. I will be purchasing these,Male,Male
C.Yi,4,QuakerOats GOOD!,These were pretty great. We got the Oatmeal Raisin but to me they tasted like Pumpkin Pie which was even better. My husband and three year old liked them as well. Especially the three year old. These cookies were pretty great. Very dense so one is definitely enough. I want to try another flavor next time too! Maybe something with chocolate!,Male,Male
deco,4,Soft and Flavorful Cookie,"I recently received a sample of this cookie, and I enjoyed it!  The cookie was soft and not too dry.  It was a little spicier than I generally like my oatmeal cookies, but it definitely had some flavor. I wouldn't say that it's my favorite oatmeal cookie ever, but I would be very okay with eating more of them  :)",Female,Female
Brian J Alinovi,5,Soft and Chewy,"This individually wrapped cookie was moist, soft and chewy. The taste was perfect and it was beyond expectations, the perfect bite.",Male,Male
STACEY MOTT,4,Delish!,"Oatmeal is one of my favorite grains and I was very excited to try these cookies, especially a soft variety.  Very yummy!",Male,Male
llsnyder7,5,YUMMMM,The oatmeal cookie was so soft and chewy. It really was very yummy as well as healthy. Will definitely buy more!,Female,Female
JennyS,5,YummY,We recently got one of the Quaker Soft Baked Oatmeal Cookies to try ViA Influenster and Quaker. And my family loved them! They don't taste store bought at all. They tasted home made!! Very soft and moist!,Female,Female
Kirin T.,4,Quaker Cookie,"Upon recieving this cookie in my voxbox from influenster I sceptical because you expect cookies in a package to be very dry and more often than not tasteless, the cookie recieved in the package was surprisingly moist and very flavorful, it tasted very good and I will definately purchase them in the future.",Female,Female
"A. Walker ""La Reina Purpura""",5,Oh so Tasty,"My daughter and I tried the soft baked oatmeal cookies and we both agreed it's delicious!  I rarely purchase premade cookies, because they are too hard for my preference, but this changes my mind.  They are full of flavor.  The oatmeal doesn't overpower the raisins and the raisins don't overpower the oatmeal, it's a perfect balance.  The raisin were soft, not hard like other brands we've tried in the past.  The price for the quality is well worth it.",Female,Female
Mary A. Camp,5,Yummy and Soft Baked! Yeah!,"I absolutely fell in love with these cookies.  I love my cookies soft and not hard, unless it's an Oreo and then I soften it in milk, but these cookies are hands down the closest I've had to homemade!",Female,Female
Naturaltwist,4,Pretty Darn Good,Less calories than a candy bar! I will take it. I was pleasantly surprised with the taste of the cookie. I thought it wouldn't have much flavor but it does. The spice of the cookie and the raisins make it a delicious treat. Now it is a soft baked cookie but to me it was a tad bit dry. It was still edible and good. I will pick up a box once they are available.,Female,Female
"Tiara ""Ms.Paris""",5,Delicious!,Got a free sample cookie from @influenster's Mom voxbox. These cookies are great they are soft and chewy and left me wanting more!,Female,Female
Carolyn Naes,4,Chewy and tasty,I was given a sample of the Quaker Chewy oatmeal cookie from Influenster. I enjoyed the taste and texture of my cookie. I will buy them again if they are on sale or I have a coupon to use.,Female,Female
"Rose A Powell ""Rose A. Powell""",5,Quaker Soft Baked!,"There is one thing that I love, I love eating something absolutely delicious and knowing that what I am eating is actually healthy and jampacked full of nutrients!!! I received a sample of Quaker Soft Baked Oatmeal Cookies from Influenster and it was delicious, and you know what else? My little sweet toothed diva, loved it too, I know this because she took it from me and made it disappear like magic! You want a healthy treat that you kids will love and enjoy too, this is a definite must try.",Male,Male
Stephareas,5,Delicious,"Greta cookies and amazing nutrition in them. Would definitely purchase this product. ,y favorite part was the delicious oatmeal put in them.",Male,Male
Rachel Myers,5,Tasty,These are very good. Nice and soft. Would for sure get again. Since they are packaged individually its nice for travel. A great snack.,Male,Male
alyloo,4,Soft & Yummy,I received these cookies to try from Influenster and they were delicious! So soft and yummy and not too small like some store bought cookies are. They tasted homemade and the whole family loved them!,Male,Male
brandymhk,5,Tasty and healthy!,We received these to try and they were fantastic my husband loves oatmeal raisin and he couldn't get enough! I think the verdict is that they're fantastic and we'll definitely be buying more!,Female,Female
benjaminsMOM,4,really soft,liked the flavor just wished it had more oatmeal in the cookie. But i do like how soft it was!!,Female,Female
Rob & Holly,4,loved the cookie just not the flavor,I loved the softness of this cookie but not to keen on oatmeal but I will be buying more of these just not in that flavor. my kids loved the cookie!,Male,Male
Stephanie,3,individually wrapped,"I've always on the lookout for handy snacks for my teenage son.  he loves soft cookies, so I was thrilled to see the soft baked oatmeal cookie from the masters of oatmeal.  My expectations were high.<br /><br />This is a good cookie, but not a great one, so I was a little disappointed.  The consistency is excellent, just what you would want from a soft baked cookie.  And it is defintely enough for a snack - at 1.48 oz and 170 calories - that's plenty. The raisins, too were outstanding. But the cookie itself was not great tasting. I wanted bigger hunks of oatmeal-- more texture, and there was an aftertaste of the preservatives.",Male,Male
