ProfileName,Rating,Summary,Review,Inconsistent Review,Gender
"jaimoi ""Appreciator of good music""",5,Delicious!,I love these cookies!  Not only are they healthy but they taste great and are so soft!  I will definitely add these to my grocery list!,Male,Male
"Linda Painchaud-Steinman ""PARK EDGE BOOKS""",5,Great Anytime of Day!,"Quaker Soft Baked Oatmeal Cookies with raisins are a delicious treat, great for anytime of day.  For example:<br /><br />--at breakfast, I had one with a large banana and a cup of coffee, and felt I'd had a relatively ""healthy"" start to the day.<br /><br />--the next day at lunch, following a tuna sandwich, I had one with a glass of milk, and was satisfied enough to not need a snack before dinner at 6:30.<br /><br />--the following night, after dinner, I had one with the remainder of my glass of wine. (Delicious!) And again, didn't feel the need to snack later in the evening.<br /><br />Each cookie is individually packaged, and their texture is soft and moist, with just the right amount of sweetness. Natural flavors used in the making are Cinnamon and All Spice.  These flavorings give the cookies a real old-fashioned, homemade taste.<br /><br />Nutritionally, the cookies have 170 calories each, 1.5g saturated fat, 150 mg sodium, and 12g sugar. They also have 2g of protein, and contain 25g of fiber.<br /><br />While the calorie count may seem a bit high for one cookie, they are good sized, and 1 cookie per serving is certainly enough to satisfy.<br /><br />Because of their great taste and texture, kids will probably enjoy them also.<br /><br />If you like oatmeal raisin cookies, give these a try!",Male,Male
carwash169,5,Very good!,"I am usually not a huge fan of oatmeal cookies, but these literally melt in your mouth. They are so soft and tasty! I would definitely recommend these to someone who loves oatmeal, and even those like me who would probably pick a different flavor over this one.",Female,Female
"P. Titus ""Knitgirlll""",5,Quaker Oats Oatmeal Raisin Mom Voxbox Review Courtesy of Influenster,"I participated in a product review that included a sample of <a href=""http://www.amazon.com/gp/product/B007JFMH8M"">Quaker Soft Baked Oatmeal Cookie, Raisins, 8.8-Ounce (Pack of 12)</a>.  Okay first of all I love Oatmeal Raisin cookies and this one was no exception.  It was great!!! Soft n chewy, nice portion size and and as always a high quality product from Quaker Oats.  Thanks to Quaker and Influenster to for including this in their Mom Voxbox.  If you haven't tried it you need to and make sure to share it with the family.",Female,Female
Jessica,5,"Quick, simple HEALTHY snack for the kiddos!!!","My kids loved these. I was very pleased to give my kids a quick on the go healthy snack before soccer and acne practice. They loved the flavor, I loved that its healthy.",Female,Female
Jazmin,5,Quaker Soft Baked Oatmeal Cookies,I really enjoyed these individually wrapped big oatmeal cookies. They are really soft and chewy. You can buy different flavors. I will definately be repurchasing these cookies in the future. They are delicious and super healthy too.,Female,Female
inca_p,4,Yummy,"I was surprised at how soft the cookie was. I usually buy Little Debbie's cookies, and I noticed the Quaker Soft Baked Oatmeal Cookie was bigger and had a bold taste.",Female,Female
Lou,5,Wow!!!!!,Filled with oats and raisins you'll love this snack ..... Delicious and nutritious ..... what else is there to say.... you can't beat that....,Male,Male
kmcwhorter,5,"soft, chewy, yummy!","I was recently given a complimentary ""vox box"" from influenster, call the mom vox box. It came with various products in it for me to try out and review the products inside. One of the products i received was a Quaker soft baked oatmeal cookie ""raisins"" flavor. When i opened the cookie wrapper, i gave half of it to my 3 year old and i ate the other half. I was immediately surprised by how soft the cookie was when i was splitting it in half. It was like a really really good home baked cookie. Soft, chewy and tasty. I normally do not like oatmeal raisin cookies, due to the raisins, but this cookie was surprisingly yummy. My three year old loved it so much that we had to go out and buy our own box. The cookies are soft, chewy, yummy, and healthier than other kinds of cookies, so  i would definitely recommend this product to people that have kids for a healthy yummy substitute to other sweets",Male,Male
michrabbit,5,so soft and good,"the best and freshest cookie that comes in a package, we ate them up, wishing we had more. soo good",Female,Female
Sailorwife76,5,Chewy deliciousness,I am a huge fan of the Quaker Chewy cookies! The moist cookies are satisfying and not too sweet. The high quality ingredients are a crowd pleaser. A must have for any car trip! After one cookie I was hooked. Highly recommend!,Female,Female
ponpon6,5,the bomb,yummy and delicious. i love eating it when it when its warm. the best store bought cookies! cant wait to buy more!,Male,Male
C Jo,5,Deliciousness,"I received a Quaker Oatmeal Soft Baked Oatmeal Raisin cookie to try/eat for free from Influenster [...]). I shared the cookie with my kids, and we gobbled up the cookie faster than you can say ""Quaker Oatmeal Soft Baked Cookies."" It was soft (as advertised) and included a sufficient amount of raisins to make me happy (I like raisins). It was soft without being crumbly, moist, and not too dense (some oatmeal cookies are pretty dense). I highly recommend this cookie to anyone thinking of trying it for the first time:)",Male,Male
Danielle,5,Yummy,These cookies were so good. Can't wait to go out and buy some more! A good snack when you don't want to over-indulge yourself,Female,Female
Pen Name,5,awesome cookies,I received these in my MomVox box from influenster! I loved it! Oatmeal cookies are my favorite and these are by far the best store bought brand I have tasted! I recommend these to anyone with a sweet tooth trying to stay healthy.,Female,Female
RF,5,Home-baked taste without the fuss,Quaker Soft Baked Oatmeal Cookies taste just like the cookies my grandma used to bake. Great to take as a quick breakfast since it is made with whole grain Quaker Oats.,Male,Male
Heather S.,5,Yummy Whole Grain Goodness!!!,"These cookies are a real hit with my children! I received a sample from @Influenster in my Mom Vox Box. I enjoyed the sweetness, yet whole grain taste (which I love) and the moist raisins. This cookie would be perfect for breakfast, snack, or dessert! What could be better than that?! I love these cookies and definitely will be buying more!",Female,Female
avbfarm,4,Quaker,I really enjoy Quaker's products and the fact that they are more healthy than most other products. These were really good especially if you like raisins.,Female,Female
margaret antonia martinez,5,So soft!,This was the most delightful cookie i ever tasted. I was very surprised on how soft and fresh it tasted. It makes a great snack on the go as well! I tried the chocolate almond as well and YUMMY! Quaker hit  this one out of the park!,Male,Male
"A. Murphy ""His Crown""",4,On the Right Road,"Quaker used some good ingredients in the cookie and one cookie eaten amongst four kids did not meet the nutritional panel for one cookie. Even if one cookie was eaten by them each the nutritional panel was pretty good.  So, I can be a happy mom about the children eating the cookie",Male,Male
Uncreative Mommy,5,Quaker Soft Baked Oatmeal Cookie,"My daughter stole it from me and ate it, I guess it's a good thing I can't stand oatmeal.  But both my kids are already huge fans of all things Quaker so it's easy for me to write this review.<br /><br />Quaker Soft Baked Oatmeal Cookies are chewy, nutrition and according to my kids, DELICIOUS.  They are made with Whole Grain Quaker Oats, individually packaged at $2.69 for a box of 6, is a good source of fiber, only contains 6 grams of total fat per cookie and sold pretty much EVERYWHERE!",Female,Female
Shari,5,Delicious and healthy!,"I loved this delicious cookie! I even shared it with my 11 month old, and I'm a pretty big health nut when it comes to what I feed my daughter. It tasted great, was a great portion and it's not full of fats and sugars like all of those other cookies!",Female,Female
jillian trapuzzano,5,Yummy,I enjoy these cookies... They taste like my grandmas homeade cookies.. Plump and super soft!!! I can't wait to try the other favors made by quacker.l,Male,Male
Todd,5,Amazing Cookies!,"These cookies have perfect flavor, excellent moist/dry combination and are very soft. They melt in your mouth. I love the taste, I could eat box after box!",Male,Male
mikoto127,5,Delicious,"Received this through VoxBox and loved it. My son ended up with most of it, which is fine. Excellent product to keep on hand or in the diaper bag.",Female,Female
"Marilyn C. Martin ""Love's Pixiebobs""",5,very tasty,"I love oatmeal cookies and have made them at least hundred times.  I love my cookies, but these come in a very close second to my under baked, soft homemade ""vanishing oatmeal"" cookies.<br />There's some ingredients in these cookies that I don't find in my kitchen cabinet, but if you're not against prepackaged food, it shouldn't bother you.<br /><br />I loved the allspice taste, but my guy friend didn't that much.  I think he's just partial to my cookies.  The individual serving size is nice.  I'm more apt to just have one cookie this way rather than opening a whole box and having to eat them before they get stale.  I could say that individually wrapping the cookie saves me from just having one more and one more and..........<br /><br />They are delicious and make me feel like I'm eating something that is somewhat healthy for me.  After all, there is oatmeal in the cookie.",Female,Female
Angela Heller,5,Yummy,I love the soft bakes oatmeal raisin cookies.  The subtle taste of the oatmeal with the natural sweetness of the raisins is wonderful.,Female,Female
Caryn Haase,5,Yummy in our tummy!,"I was pleasantly surprised when I tasted these oatmeal cookies, they were delicious. It is a great go to snack when you are out and about and need something quick... and the kids love them!",Female,Female
Elaina B,5,"I usually don't like soft baked cookies, but....","This was delicious. I was hesitant about trying it, but I was pleasantly surprised. It was so delicious and soft. I like my cookies crunchy and well done. Lol When baking my own I usually lightly burn a few for me. But this cookie was so good. I think I will make an exception for the Quaker Soft Baked Oatmeal Raisins",Female,Female
Karla,5,Delicious!,"I received a free sample of these cookies through Influenster and immediately got hooked on them. They're are so soft, perfect for anytime but specially for breakfast. My son loved them even though he doesn't like Oatmeal. I had to purchase more and now we treat ourselves every morning to a yummy cookie.",Male,Male
"J. Clark ""Joyce C.""",5,A very good Cookie!!,"I loved the texture, the natural taste, and the softness was just right!!! If you are wanting a good cookie to take o the go, or for anytime, this is a very good choice!!",Male,Male
Crease in the Page,4,"Good, but not homemade.","First thought--not as good as homemade.  Second thought--good anyways.  Homemade oatmeal cookies are chewy, moist, a slightly crisp outer layer... but these cookies are cakey throughout.  The other thing that sets them apart from homemade cookies is a slight taste of preservatives--or something--something different and packaged-tasting about the flavor.  They're not too sweet, which I like.  My kids have started revolting against granola bars and protein bars as snacks on our day-trips--I think this would be a good thing to take instead.  Filling, good energy boost, tastes better than an energy bar.",Male,Male
rose thyme,5,Very Good Oatmeal Cookie,"These are nice soft, spicy oatmeal cookies with a rich molasses flavor.  They are a perfect single serving size, in a perfect individual wrap.  They have a good taste, natural, not artificial and are a satisfying snack.  I would buy these to take for a snack or lunch.",Male,Male
L A.,4,Very good cookie,"Good store bought cookie comes individually wrapped so every one is fresh.  Has a slightly burnt flavor, the bottoms of the cookies were very dark, almost burnt.  Soft and chewy with a sweet tast, could use more raisins and a stronger oatmeal flavor.  Overall, I liked them and my son loved them.  I guess the younger folks will like how sweet the cookie is.  Not like homemade but very good for store bought.",Male,Male
Mal,4,SO GOOD!,"i was surprised i liked it! i normally don't like oatmeal cookies, but these were sooo soft and chewy. it was delicious. i shared one with my daughter and she wolfed it down!",Male,Male
The book lady,2,Dry,"Oatmeal cookies aren't my favorite but I do enjoy them from time to time but you would never know it by this cookie.  The first bite was pretty terrible, though they did seem to get better about half way through the cookie.  It was so dry and had a sawdust kind of texture.  I think the problem is the main ingredient is ground up oats, then with whole oats and wheat flour, instead of the recipes I've made with more whole oats and then wheat flour.  Even though I don't really like raisins they were the best thing about these cookies.  At least a bite with a raisin was a tiny bit moister.<br /><br />Not only that but it was 170 for only one cookie.  If this was a diet cookie, maybe I wouldn't be so harsh about the texture, but 170 for one cookie sure isn't diet food.<br /><br />2 stars.",Male,Male
akollar,5,Quaker Soft Oatmeal Cookies,"WOW, I gave it to my son to try and it was gone within SECONDS. Then he goes, ""Mommy, can I have more?"" and I had to then go out and buy some more of these great cookies. I was very impressed with the packaging and how SOFT the cookies really were when you opened them and the flavor that they had. Very Impressive. Would definitely buy!",Female,Female
"C Wahlman ""cdub""",4,A tasy cookie from Quaker,"Quaker products always mean good tasting.  They also mean a healthier option of processed snacks.  Soft Baked Oatmeal Raisin Cookies are indeed soft and moist.  Each cookie is over an ounce; a nice size cookie.  You can see the whole oats and raisins.  I can taste the raisins and spices as well.  It is a tasty oatmeal raisin cookie.<br /><br />There are six individually wrapped cookies per box.  I like the individual wrapping as it keeps the cookies fresh and aids with portion control.  Per cookie you are looking at: 170 calories, 6g of fat, 27g carbohydrates, 4 g dietary fiber, 12g sugar, and 2g protein.  The first ingredient is whole grain oat flour.  Nutritional facts are displayed on each individual wrapper as well, so nutrition, ingredient and allergy information is accessible even without the box or the internet.<br /><br />For a convenient, cheaper and healthier option, Quaker's cookies are a good choice.  I recommend these cookies.  I hope to try the chocolate almond flavor next!",Male,Male
a.abston,5,Quaker Soft Baked Oatmeal Cookie,This is more than just a cookie. It is a guilty pleasure. Except that you dont have to feel guilty because it is good for you. It is so soft and fresh you would think your grandma just baked it. LOVE LOVE LOVE it!,Male,Male
Southern Girl,5,Love the softness of this cookie!,"I received a sample pack of the Raisin variety of Quaker Soft Baked Oatmeal Cookies from Influenster to test out with my family.<br /><br />My 22 month old son loved the cookie and almost ate the whole thing himself. I did manage a couple bites and I love the soft, chewy-ness of the cookie. Plus, it provides a good source of fiber, something we don't incorporate enough of in our diets sometimes. I will definitely consider purchasing more of these cookies as a snack for my son!",Female,Female
hashepard,5,Love these cookies especially for the kids,The soft baked cookies are amazingly delicious! Even my children really enjoy them!! I was surprised when they all actually ate it because they never eat anything with raisins in it. This was exciting since I now keeps these with me in case the boys need a snack since they would be able to eat one between the four of them.,Male,Male
kilee,5,My kids loved them.,"My kids will devour these cookies. They must be super good because believe it or not my kids are picky cookie eaters. I do not like raisins personally so I haven't tried them myself. My only negative thing I can think of is that they are very crumby because they are soft, so with kids it gets quite messy.",Female,Female
Home Studio,4,Lunchbox or Work Staple,"Quaker, which knows a thing or two about oats, has put together a pretty nice oatmeal cookie here. The cookie is soft, as advertised, but is NOT pillowy, doughy, gooey or some other displeasing variety of soft. Rather, it just has a nice yielding softness. No doubt related to the consistency, the cookie is not cloyingly sweet. Oh, it's still definitely a cookie - but you're not overwhelmed with a sugar rush. The raisins didn't add a lot of flavor - the ones I encountered weren't large or anything remotely like plump.<br /><br />Overall, this seems like a relatively low-guilt addition to a lunchbox or a desk drawer for snack time. Tasty, soft, and full of oatmealy goodness.",Male,Male
mrssaxton,5,So Delious,"After trying these cookies for the first time, i am hooked and dont feel guilty because they are delicious. Thanks Quaker for another awesome product.",Male,Male
"Satia Renee ""Satia Renee""",3,Over-Packaged Product,"In one box you get six cookies, each individually wrapped.  Which is all meant to be quite convenient, I suppose.  Throw one in your child's lunchbox and send him/her off.  Frankly, these cookies are not nearly as delicious as the ones my husband and I make and ours are lower in fat and calories, with fewer additives.  In other words, healthier.<br /><br />But ""healthier"" isn't why most people buy pre-made food products and these cookies taste good enough.  I love oatmeal raisin cookies and I wasn't disappointed by these enough to dislike them.  However, <a href=""http://www.amazon.com/gp/product/B004L5UD2K"">Grandma's Homestyle Oatmeal Raisin Big Cookie, 2.5 Oz Bag (Pack of 20)</a> are lower in calories and have the same amount of fat, per cookie.  (Of course, it's hard to eat just the one when there are two in the package so you'd have to share.)<br /><br />I know that it's hard to find time to bake from scratch sometimes but the effort to do so, teaching a child how to measure and mix a recipe from scratch, to then enjoy something that the two (or three or four) of you made together, is invaluable.  Make a double batch and freeze the dough before baking and you wouldn't have to do this every week to have enough cookies to last entire month or longer.  You'll build bonding moments, create less waste, teach simple mathematics and cooking skills, and provide a far healthier snack option for your child(ren).<br /><br />And if you truly don't have the time to bake cookies, then buy some fresh fruit.  If nothing else, you'll have fewer additives and most fruit comes in it's own convenient packaging.",Female,Female
A. Thomas-zuniga,5,yum,"I received 1 to try out and wasn't to sure what to expect. they are delicious i have to say, will definatly be buying more",Male,Male
PETEZO_MOMMA,5,Great taste,Love these cookies my Son asks me to heat one for him in the microwave for about 15 sec its soooo good that way gives it the freshly baked feel...I always make sure to keep in stock in my home...they are also individually packed do makes it easy to carry along in my bag,Male,Male
NicoleBeauty,5,Yummy!!,These cookies are so soft and tasty. I love the texture of the cookie!! I will definitely be eating these cookies as a snack for lunch.,Female,Female
Arthur Kimes,2,"Well, the foil packet is handy...","Quaker Soft Baked Oatmeal Cookies (raisin) fail the most important test of a cookie.  They are not delicious.  Considering they're 170 calories for ONE cookie you'd expect something decadent.  It's not even as tasty as an average cookie.<br /><br />A little bit dry considering it's supposed to be soft, moist cookie.  A slight sandy or grainy texture.  There's nothing foul or obnoxious about the taste - it's just nothing special.<br /><br />Nutritionally - ok for a cookie.  170 calories, 1.5g sat fat.  4g fiber!  (quite a bit.)  But I don't look at a cookie as some sort of health food.  A big* cookie like this should be an indulgence - a treat.  Instead it's not abhorrent.  If you start eating this, you'll finish it.  But you won't go out of your way for another one.<br /><br />*not THAT big.  It's not like a famous amos or something.",Male,Male
CYBERMOM10,5,TOTALLY DIFFERENT!,"TOTALLY DIFFERENT!<br />chewy, soft-baked cookie, Healthier alternative,<br />Individually packaged / Good for on the go!<br /><br />The Verdict:<br />Great Healthier snack for all the family!<br /><br />I don't like oatmeal & raisins... but this cookie really taste great! :D",Female,Female
JexyTorres,5,Soft Baked Cookies,It is nice to have a cookie that my kids enjoy and I don't have to worry about it being unhealthy. I was very happy to receive this in my Influenster Mom Voxbox!,Male,Male
shelbielise,5,Yummy,I was very surprised how soft they were. I gave one to my kids and they loved them. Definitely getting more for them!,Female,Female
thefatman420,4,Scrumptiously soft delight,"These are great on the go treats for adults, and the kids too - if you wanna share ;)<br />They're bursting with flavor and nutritious to boot.",Female,Female
sarah,5,so good,totally my kids favorite cookie so good soft not so much sweet exactly one that i want to give my kid,Female,Female
Courtney Pies,5,Quaker Soft Baked Oatmeal Cookies - My New Favorite,Quaker Soft Baked Oatmeal Cookies are now my favorite cookies.  They are so soft and delicious.  And I love how they come individually wrapped so I don't have to worry about the rest of them going stale.<br />I definitely recommend giving these cookies a try - you'll be glad you did!,Female,Female
Christy,5,So Good!,"I got a sample of these from Influenster, and I went out and bought more right away.  These are the softest and tastiest packaged cookies I've had.  I love the flavor, Oatmeal Raisin cookies are my favorite.  Even though they are cookies, I feel like I could be doing a lot worse health-wise than these.",Male,Male
Mouthpiece,4,"Just enough to satisfy your sweet tooth,","I received a sample package of this product complimentary from [...]  to try. I must say, it was super yummy. The cookies are large enough to satisfy my sweet tooth yet small enough that i didn't feel like I was gorging myself either. Best part is, they are healthy enough that i don't mind feeding them to my kiddos as a special treat.",Male,Male
"Kelsey Fabricius ""Curious tech junkie""",5,Yummy and good for on the go!,"Love the soft baked cookies, tastes great and I don't feel guilty eating this cookie. They are also individually wrapped so it's great for throwing in a bag for hiking or in kid's lunch. I tried the oatmeal raisin and must say it's my favorite, apparently many others favorites as I can never found them on the shelves.",Male,Male
mel,5,my kids loved them,I got the influenster box and it had several products in it.  My kids loved the quaker soft bake cookie.  would get some if I were you,Male,Male
lmonkeybad,5,Yum,Cookie was so soft and my son acutally loved it and he really doesnt like a lot of item. I really love this cookie and i did purchase again.,Male,Male
"crystal allen ""crystal""",5,fresh baked taste,my kids and i enjoyed the Quaker Soft Baked cookies.  they are great for lunch boxes and for snacks at home or on the go.  i loved the soft baked texture and fresh taste.,Male,Male
london&amp;lexington,5,great tasting cookie,This is a great tasting cookie.  Portion size is close to perfect.  Soft texture with almost homemade flavor.  What a find?!?! I love these cookies!,Male,Male
Julieannamtz,4,Delicious Quaker Soft Baked Oatmeal cookies!,Quaker always surprises me with all their wonderful products which are satisfying for the whole family. I really love these Oatmeal soft baked cookies!! They are made from whole grain quaker oats and have a wonderful flavor! I can't wait to buy more of these and other yummy products!,Female,Female
"Sandy ""dacotahsgirl""",5,A Delicious Cookie!,"I really enjoyed these cookies. They tasted fresh & homemade and very soft and chewy.....I will purchase again, definitely a favorite!",Female,Female
ngreen034,5,just like grandmas,"I just love the oatmeal raisein cookie it was super soft and delicious, i was amazed by the amount of raisens in it because there usually isnt enough in other brands. Not only did i love this cookie but my daughter loved it so much i had to go out and buy a box of them. Id def. reccomend these to any cookie lover, im a fan for life.",Female,Female
"TexasMom81 ""Kimberly""",5,Yummy Homestyle Taste,"These are so yummy. They taste just like my grandmas homestyle cookies. They are a perfect texture, just enough sweetness, and leave you craving for more! I can't get enough of them. I eat them with a nice glass of cold milk and it's heaven!",Female,Female
C. Dykstra,4,Love this,These are really good.  I love raisin cookies and this one did not dissapoint me.  It is soft and they are in individual packs.  I got it free from Influenster to try and liked it.,Male,Male
Mark in Idaho,2,Mealy texture for an oatmeal cookie,These cookies would be better if they were made with rolled oats instead of oat flour. The crumbly and mealy texture does not provide an enjoyable experience.,Male,Male
