ProfileName,Rating,Summary,Review,Inconsistent Review,Gender
Pebbles802,5,Delicious!,"These cookies are absolutely delicious, I received one for review purposes from Influenster.com. I took a bite and gave the rest to my son, which was gone before I even had a chance to change my mind. LOL One of the moistest, most delicious cookies I have ever had, hands down. The only drawback that I found was that my cookies was broken into about 5 pieces, not sure what happened, but that doesn't effect the flavor!",Male,Male
Blanca,5,Yum!,These cookies are so good. They taste homemade! Very tasty and healthy! Usually I only think oatmeal when I think of Quaker...I was wrong!I got a free sample from Influenster! :)  I will be buying for sure!,Female,Female
April Clemmons,5,Quaker Soft Baked Oatmeal Cookies,"When I tried the cookie I noticed that it was very soft, moist, and chewy. I usually do not like raisins, but they were very good in this. They actually tasted like homemade to me. And I grew up with a grandmother who always had fresh baked cookies in the kitchen. Having three kids of my own, of course I had to share with them. My son's comment on the cookie was, ""That's really yummy, Mommy!"" I am pretty sure we will be purchasing these in the future because my two boys keep asking if there is another cookie in my VoxBox.<br />I received a sample of the Quaker Soft Baked Oatmeal Cookie with Raisins in my MomVoxBox from Influenster for review purposes only. All opinions are my own.",Male,Male
patricia morreale,5,Yummy!,"This cookie is so good, I received a sample from Influenster and when I opened it, it smelled like a homemade cookie...it tastes so fresh and it is filling, you only need one and you are good to go! I will be buying these in the future!",Female,Female
Littleshow,5,Quaker Soft Baked Oatmeal Cookies are Delicious!!,"Was very happy when I received the Quaker Soft Baked Oatmeal Raisin Cookie in my Mom Voxbox from Influenster to try! I had seen them on commercials but never remembered to buy them when we went to the market, but I will definitely remember to buy them now!! What a delicious cookie and it is good for you too! Me and my son enjoyed our cookie with our lunch and it was a hit with both of us. It was such a soft and flavorful cookie that filled you up and left you satisfied. I will definitely be trying other varieties of the Quaker Soft Baked Oatmeal Cookies and will be recommending them to hall my friends!",Male,Male
Brandi,5,Yum yum,These cookies are very good. My daughter tried the sample and then I went out and bought a box. The whole family loves them. They are very soft and moist. It is a new snack in our household!,Female,Female
mamaeul,4,Really great!,"I received an Oatmeal Raisin Cookie in a Influenster box and I loved it! Tasted just like a homemade cookie, really fresh and chewy. I would definitely buy more!",Male,Male
Cookie monster,5,LOVE THESE!,These cookies where so great and yummy! took my candy craving away!  you should for sure buy this! The rasins are great and fufilling,Male,Male
MamiOf4,5,Soft & Delicious Oatmeal Raisin,I received Quaker's Soft Baked Oatmeal Raisin Cookie as a sample in the mail. The cookie is really soft and a very nice size. The raisins taste very fresh and it's just like eating a freshly baked cookie; you could even put in the microwave for a bit to get the fresh oven baked feel.,Female,Female
Holly Walton,5,Yummy!,Received this in my influenster box my son Loved it! : )  Had to purchase more. It was nice to be able to try something to see if I liked it first before purchasing it.,Male,Male
Sylvia713,4,Quaker oatmeal cookie,These cookies are very delicious! They are nice and soft so i could even give them to my 2 year old.,Male,Male
Megan,5,One Year Old Son Loves these! @quakeroats,"This morning I gave my son a quaker oats rasin cookie for breakfast. When we took it out of the package it smelled amazing. I wish I was able to try this with him, but I have celiac and am gluten free. However my one year old son gobbled it up. It was super soft and chewy. There were visible oats and lots of rasins. I like that they were healthy. I did not mind giving this for breakfast as a treat because they are quaker oats!",Female,Female
Patsy1985,5,Awesome Cookie,"I don't usually like Oatmeal Raisin cookies, but when Influenster sent me this cookie to try, I did, and I was pleasantly surprised to find that I loved it! So great, so soft, and so delicious. I definitely recommend that everyone try this cookie.",Female,Female
army_wife0301,5,Amazing Cookie,I received this Quaker Soft Baked cookie from Influenster. This was my first time trying it and ohhh my!! It was fresh tasting. Very chewy and busting with flavor.,Female,Female
Amanda,5,Very Soft Yummy Cookies,I love these cookies!!!! They are very soft and actually taste like the homemade cookies your grandma would bake. Which is a great compliment to Quaker considering I think my Grandma is the best cookie baker ever! I also like that the cookies are a good snack that are not super high in calories. I will for sure be buying these cookies again and recommending them to all of my friends.,Female,Female
Annette,5,Yummy and kids loved it,"I received this from Influenster in the Mom Voxbox. When I offered to my kids to try the Quaker Oatmeal Soft Baked Cookie I literally had a crying baby on my hands. She did NOT want anyone to eat any of the cookies she says ""I's MINE!"" Even getting a new box ""It's mine"" have to hide it.  Thanks!! Annette G",Female,Female
Karen,5,Great Taste and Super Soft,"I know they say ""soft baked"" but how often is a packaged cookie really all that soft? Well, these are super soft!  The first thing I noticed when I opened the package was that the cookie was so soft and moist that it broke apart with little to no effort.  I shared the cookie with my preschool daughter.  We both loved the taste.  I'm not usually an oatmeal cookie fan, but I really liked this cookie.  My daughter asked me to buy her more of them.  That in itself makes it a winner, ha!  These are great cookies and will become a staple in my pantry.",Female,Female
Jessi,5,Healthy and yummy too,We love these! They are so soft and tasty. They are a healthy filling snack. So easy to just stick in your bag and enjoy on the go!,Male,Male
Kaylie,5,Great Snack!,"These were great! These cookies were soft and very tasty, almost like fresh baked.  They were much larger than I expected. Great product, you won't be disappointed.",Female,Female
Nicole,5,Delicious!,"This cookie was so soft, and delicious. I definitely plan on buying more! Perfect snack to have on the go or just at home with a glass of milk.",Female,Female
Alyssa,5,Delicious,"The cookie is amazing, very soft. My daughters ages 4 years old and 10 months couldn't resist them. I had to buy another box right away.",Male,Male
Ashley,5,loved em,"they are great, tasty and delicisous.  We even tried the banana nut ones, they were fantastic we loved them.  My kids loved them a great breakfast on the go...",Female,Female
"Iron Man ""JON""",4,Great tasting and very filling!,"The Quaker Soft Baked Oatmeal Cookie, Raisins, is a great tasting snack that gives you that full feeling. Just 2 of these cookies gives you that satisfying full feeling. Since it is made out of oatmeal and raisins, we could classify it as a healthy snack. But on the nutritional breakdown, would be better if this snack would go down on a less than 5mg cholesterol. The per serving content of cholesterol is 15mg, sugar is 12g, so as with any other food, moderation is the key. Nevertheless, anything oatmeal gives you a great start on eating, whether to maintain a healthy lifestyle or starting one.",Male,Male
Mary,4,Yummers!,"Chewy, sweet goodness. These cookies are right up my alley. I even liked that they were individually packaged--great for lunch boxes or for keeping cookie monsters from devouring the entire package in one sitting. The individual cookies weren't huge but they were big and chewy enough to satisfy a sweet tooth with just one package. They weren't overly sweet or overloaded with raisins--someone must have studied the cookie-to-raisin ratio and came up with the perfect number. I'll definitely much on these again.",Female,Female
William T. Barto,3,"Nice texture, not so much taste","This is an interesting product - the texture is immediately attractive and quite remarkable given that it is a packaged product, but the flavor is not quite right. There is a sense of artificiality about the flavor that may come from preservatives or flavoring additives. My family ate all the samples we received, but there was no real drive to go out and buy a box, even among my otherwise enthusiastic cookie-eating teens.  I think that the product needs a trip back to the drawing board if the goal is authentic oatmeal cookie taste and not just texture.  Sorry!",Male,Male
"Ambergris ""John Thomas""",4,Good Buy Here......Average Oatmeal Cookie,"As a lover of oatmeal cookies since the days of being a kid, I was anxious to try these from such a well known brand.  I have always been someone that sticks to either cheaper brands, or the kind of cookies that are made in a markets own bakery.  Personally I think the latter are the best there is in most cases as far as store bought is concerned..  As for these Quaker cookies I found them to be just average in taste.  The box I got held very fresh cookies individually wrapped that were satisfying in flavor, but not at all anything special.  Personally I don't think the heavier cost of these are worth it for just being a famous brand.  You can do at least just as good with other store bought brands, and much better in my opinion in buying your local markets cookies.  On the other hand if you happen to be a big fan Quaker Oats cookies, or just enjoy the particular flavor of these, buying them here in the big 12 pack is not a bad deal at all.  The cost is enough to get you the free shipping, and the convenience along with the reasonable price makes it a sold deal.  Enjoy if these are your favor.. : )",Male,Male
"Wilhelmina Gaudy ""coolartsybabe""",4,Great Flavor But Too Dry,"Quaker soft Baked Oatmeal Cookies with Raisins taste pretty darn good. The only draw back are they're too dry. Still, much better than many other similar cookies made by other companies, some who make their products even drier and why sweeter. Still, with a cup of tea or coffee they make a pretty good snack or bit of an after dinner treat. I was disappointed when I reached into the box for a cookie after lunch and realized I'd already eaten them all!",Female,Female
Leslie,2,Not bad but not good either,"I'm always on the look-out for a good tasting, individually wrapped, healthy snack that I can toss in my bag for a quick bite. Oatmeal cookies are one of my favorites so I gave these a try.<br /><br />The packaging is fine but the cookie does not have a very good taste. It has a dry texture to it, not very oat-like at all. They are soft, but not moist. There were plenty of raisens but not enough spice for my taste. On the positive side, they do contain more fiber than most cookies, but at 170 calories each, they are a little fattening.",Male,Male
"John H. Gruver ""brainactiv""",1,Way too much oat bran = chewy but dry cookies,"I tried one: gave it two bites (to be sure) and then into the trash. Not even close to appetizing. It's amazing, how can something be chewy and yet powdery dry and quite tasteless simultaneously? Quaker's R&D figured out the conundrum and produced these ""cookies"". I assume it's the oat bran since I had similar experiences with using it when it was THE thing to do (e.g., pancakes). However, what ever it is, it ain't good! I do not recommend these, not even to my sworn enemies!",Male,Male
Michael Gallagher,3,Good Taste and Flavor But a Little on the Dry Side,"This is a pretty good cookie in terms of taste / flavor, but as cookies go I will say it was a little dry with the actual cookie part and not as moist as I like with oatmeal cookies (the raisins were moist).  Each cookie is individually wrapped vs. opening up a whole box which makes for a good snack to take the edge off of your day.<br /><br />Each cookie is 170 calories with 6 grams of fat (9% of recommended daily value) and 4 grams of dietary fiber (16% of the recommended daily value), so I really don't want to eat more than one a day!",Male,Male
Boilermate,4,Pretty Good Cookie,"First of all, I like that the cookies are individually wrapped. I can grab one and stick it in my pocket on my way out the door in the morning.<br /><br />The cookies themselves are big and a good thickness. They are soft with out being crumbly. The promised raisins are mostly small bits of chopped raisins and don't really add to the flavor of the cookie. I would have like whole raisins. The taste is mostly oatmeal with just the right amount of cinnamon. They are also dry. You really need an accompanying beverage with these. They are hearty enough that one makes a good snack.<br /><br />While I would never mistake these for Mom's oatmeal cookies (or mine for that matter) they're not too bad for ""store-bought."" If you like oatmeal cookies, give these a try. Just have a drink ready, too.",Female,Female
Sherry Berry,4,Soft and chewy but a bit too sweet!,"I am kind of shocked that these cookies were too sweet since I have really enjoyed how Quaker can make food be sweet but not too sweet. These are all individually wrapped, which is easy for on the go and keeps the cookies extra fresh. Each cookie is a decent size and we ate these over a week and it kept its softness.<br /><br />For me, it was a bit too sweet and I am a big sweet eater. I actually don't taste the oatmeal as much and more of the raisins, which could be why it was just so sweet to me.<br /><br />It was still yummy and I would get it again but only if I am in a really sweet mood.",Female,Female
"S. and L. Nester ""LeeLee""",4,Delicious!,I loved these cookies! My daughter eat them right up. They are soft and taste great. I like softer cookies and this one was a hit with my whole family.,Male,Male
Missy B,2,"Just ""meh"" - Definiately not a healthy choice!","Chock full of sugar!  Absolutely not something I would serve to my family.  Obviously, all cookies have sugar in them, but these seem to be a bit excessive.",Female,Female
kingandqueen1021,4,Just like homemade!,"I recently received the Quaker Soft Baked Oatmeal Raisin cookie as a part of my Mom VoxBox from Influenster.  I was a little apprehensive giving the cookie to my own two ""cookie monsters"" because they have not been big raisin fans, but they LOVED it!  The texture is so soft and chewy that they gobbled it up and asked for more!  They never even noticed the raisins!  I will buy these again as a special treat for them :)",Female,Female
Rachel S,5,Tasty and chewy,"I got these in the Mom VoxBox from Influenster, and was excited to try them!<br />They are chewy and delish! I can see these disappearing and having an empty box sitting around!<br /><br />I'm not a fan of hard crunchy type cookies, so these were right up my alley!",Male,Male
NoahsMommy52,5,Prefect Treat for My Little Guy!,My 3 1/2 year old loved this cookie!  We shared it and I'm pretty sure he would have eaten the whole thing!  Very soft and th perfect amount of sweetness- not overly sweet like some oatmeal cookies tend to be.,Male,Male
nmart512,4,Healthy Goodnesss,Very soft and chewy! Love the homestyle taste of the cookie and that it is very nutrious! Definetly gotta get some more!,Male,Male
M. Weeks,3,Quaker Soft Baked Oatmeal Cookies,"Well, let me start by saying these cookies are very soft and moist. However, I did not really like them. They were not sweet (which is a matter of personal preference) and they had a gritty texture to them.",Female,Female
Jaime M,5,Best Store Bought Cookie EVER,These cookies are delicious. They are full of flavor and taste moist and fresh. My kids loved them!!! My expectations were exceeded!,Male,Male
mrs. j-one,5,Very yummy and soft,This cookie is one of the best cookies that i have tried in a while since i do not like the hard crunchy ones like chips ahoy because it is so soft to the bite and pulls you in to make you want more. You can taste all the ingredents none are hidden and has a good amount of raisins in the cookie. I will be buying these for my family as long as they make them.,Male,Male
Patricia,5,Homemade Cookie,"Quaker Soft Baked cookie taste homemade, I like that is made with whole grains, low calorie & just healthy yummy goodness that everyone in the family can enjoy. I feel good about buying this because the ingredients are simple & I have used Quaker for years. Is a much better alternative than the other regular cookies you see in the store. Packed with raisins & whole grains. Great to pack, on road trips or just in your purse. Kid tested and approved! I received this product complimentary to test through Influenster's VoxBox program.",Female,Female
Krysti Mckay,5,Quaker Soft Bakes are DELICIOUS!,"I have absolutely fallen in love with the soft baked cookies! My kids love them, and I love them as a treat to munch on. However, they also can be used in delicious cookie crusts or cookie crumbles for recipes! They are so versatile and delicious! I definitely recommend them to everyone! my husband isn't even an oatmeal fan, but LOVES these cookies!!",Male,Male
acavano,5,gone too quick,"These cookies are to die for. I ate mine in a matter of seconds and was ready for the next one, but I only had one. I recommend these cookies for anyone kids, adults and the elderly. Its deliciously soft packed with raisins and yumminess!! Go to the store now and buy them, you sure wont be disappointed.",Female,Female
L. Brown,5,I LOVE these!,"These are soft, chewy, and delicious! They really do taste just like homemade cookies... with natural ingredients. They are a perfect treat, but still feel like a bit of a healthy snack as well.<br /><br />* I  received this product complimentary for testing and review purposes from Influenster",Male,Male
movein,5,Loved It,I let me daughter try some and I ate the rest. She isn't big on raisins but it was still good to her. I thought it was delicious because it was soft and tasted like it was just baked from the oven. I would highly recommend it and who doesn't love a good homemade cookie. Cause that's what it felt like to me. Like someone had just gave me a freshly baked cookie.,Male,Male
Becca Wilson,5,Soooo good!,"I received this product through my Influenster Mom VoxBox. My son immediately ate it up and said to me it was ""the best he had ever had"". My son is four mind you! So this must mean something. I would definitely go out and buy some for my household after hearing that reaction :)",Female,Female
"Brenda Patterson ""pattersonmom24""",5,Yum!,This product was provided to me for free through Influenster. My family love these cookies. They are soft and slightly chewy. My 2 yr old will only eat these oatmeal cookies. So he really enjoyed them.,Female,Female
Cassayers,5,Yummy cookies,I received this through influenster mom voxbox.  My children loved it and I felt great knowing that it is a healthier cookie than others on the market.,Male,Male
Christy Spear,4,chewy cookie snack,i received a sample of the quaker soft baked oatmeal cookie through influenster.  the cookie was quite large and was filling.  it satisfied my craving for a sweet without too many calories.,Female,Female
Holly,4,Yummy Goodness!,Received this in my VoxBox and I thought it was super delicious very soft and chewy! I'm going to purchase the pack of 12 this week!,Female,Female
CaSandra,5,Soft Baked Goodness!,"I received a sample of the oatmeal cookies through Influenster, it was a large size cookie so I decided to split it with my husband and my 5 year old son, I didn't think my son would eat it but after his piece was gone he asked for more! Even my husband thought it was great and he does not really like oatmeal cookies. I will buy these now!",Female,Female
Jennifer Eull,5,Quaker Cookie,"I received a free sample from influenster.com in the Voxbox i got, and my daughter really loved it!! She wouldnt even let me sneak a bit off it, so it must be really good!!!",Female,Female
Petals,5,"Soft, chewy and delicious",I recently received a sample of this Quaker Oatmeal cookie in my Mom Voxbox from Influenster and I couldn't put it down.  The cookie is a nice big size and is full of flavor. Its not overly sweet and has that homebaked taste to it.  I can't wait to get more.,Male,Male
tester,5,These were delicious!,"I received one of these to try for free and review from Influenster in my mom Voxbox and I have to say, it was the softest, chewiest cookie I've ever had. This is saying a lot since I'm picky about cookies being soft and chewy. I'm anxious to try the other flavors. Especially the Apple Cinnamon one! Yum!",Male,Male
sweetT,5,Husband Loved The Oatmeal Cookie,My Husband Loved The Oatmeal Cookie he said that it taste home made. curbed appetite like a snickers would have. He said they taste  natural would try them again.,Female,Female
zdrobles,4,So Delicious!,I received a sample of this product from Influenster.com. They were delicious cookies I have to say. I don't usally reach for oatmeal cookies they are just not my favorite or my son's favorite. I love how homemade they taste. Nice and soft real taste of oatmeal and raisins. I will definetly continue buying some of these especially because enjoyed them!.,Male,Male
AFWIFE08,5,Delicious!,These are SO yummy! They are incredibly soft and take me back to my childhood when my grandma would make oatmeal raisin cookies. My toddler loves them too!,Male,Male
Consumer,5,So good and so good for you!!,I have always loved Quaker brand products.  I had recieved a Oatmeal Rasin cookie through @influenster to try and review.  My boys actually were going to fight over who got to eat the cookie so I did the old one kid break it in half and the other one choose what half he wants trick.  They were left wanting more!  I have already repurchased these cookies several times in different flavors.  I am happy that they are good for them and make a great snack.,Female,Female
AmyH,5,So Good!,Quaker Soft Baked Cookies are incredibly soft and chewy! And they taste so good! Definitely the best store bought cookie out there! I received a free sample via Influenster.,Female,Female
LaceyMarie,4,So delicious!,"So soft and chewy! It's a great snack for yourself and even your little ones! I recieved a free sample from influenster.com and this was the first thing that caught my eye. It has a great taste, and I can see myself buying more in the near future.",Female,Female
chailinh,5,"yummy, soft baked cookie!","I have always enjoyed Quaker products and when I received a free sample of their soft baked oatmeal cookie from Influenster, I was very excited to try it. It's very soft, delicious, and taste like it was homemade. After tasting it, I went out and bought a few boxes for my family and I to enjoy.",Male,Male
Bee,4,love these!!,"If you like soft cookies, then these are for you. Great ""healthy"" snack! Don't  leave 'em in your gym bag though, you'll have a bag of good tasting crumbs!",Male,Male
Ashley,4,Loved!,I really loved this cookie. The calories in it are not bad and the taste is great. I am always looking for a quick on the go breakfast and this hits the nail on the head. It would go amazingly with a cup of coffee. The cookie was soft and full of flavor. The only thing that I didn't love was it kind of had a salty after taste. If the sodium could be reduced just a smidgen then it would be the best cookie I have ever tasted. I would buy these if our commissary would carry them!,Female,Female
forever18,5,soft & chewy,"I got a free sample via influenster, I'm not gonna lie the Quaker cookie was the first thing that caught my eye. First of its was so soft & chewy its just melts in your mouth. I definetly stocked up on the cookies. I tried the oatmeal cookie & its still my fav!!",Female,Female
Dessie A.,5,Soft and Delicious!,"I love how soft the Quaker cookies are! Not only are they soft but they're delicious too. Grab one for a snack on the go, put in your kids lunch box, or just enjoy at home. They're great!",Male,Male
MsJen,5,wonderful cookie,I recieved this cookie via the mom vox box on [...]  and after I had it I searched the supermarket for them because they are soooo good. The cookies are moist and chewy.,Male,Male
galateasmith,4,Soft Cookie - Powerful Cinnamon,"Got a free sample via Influenster of the Quaker Soft Baked Oatmeal Cookie, Raisin flavor.  First, it soft and crumbly. Secondly, it has a strong cinnamon flavor.  Thirdly, the raisins are actually good and add some texture. If you like oatmeal cookies, you will like this product.",Female,Female
Jamaise Wilson,5,Quaker Soft Baked Oatmeal Cookies testing experience @ Influenster,"I've had other store bought cookies, these are better quality - more deluxe. I buy and bake a lot of gluten free for my son, so this was a real treat and just for me! A great snack for on the go.",Male,Male
tbaker,4,Yum,"I really liked this cookie. It was very soft and chewy just how I like my cookies. The only problem was it could have been sweeter, maybe with some chocolate chips in with the raisins it would have been even better. I think for a quick breakfast great choice, not so much as a sweet though.",Male,Male
kandikisses,4,taste amazing,taste amazing and  have that home baked feel. they are so soft and chewy. perfect with a glass of ice cold milk.,Female,Female
"H. Meek ""sweetheartmama""",5,Tastes Homemade,I tried the raisin oatmeal cookies and they are so soft!  I am not a raisin fan but I still loved these and think they taste homemade!,Female,Female
